{
  "year_level": "5-6",
  "subject": "Design and Technologies",
  "curriculum": "ACARA v9",
  "standard": {
    "code": "AC9TDE6P03",
    "title": "Use suitable materials and techniques",
    "description": "Select and use suitable materials, components, tools, equipment and techniques to safely make designed solutions",
    "strand": "Processes and Production Skills",
    "mode": "B",
    "prior_knowledge": "Students can select and use materials, components, tools, equipment and techniques to safely make designed solutions (AC9TDE4P03). They have selected and used tools and materials with guidance. They have not yet matched selection decisions to design intention with explicit justification, or applied the full range of safety, hygiene and environmental considerations across material types.",
    "progression_endpoint": "Students select materials, components, tools, equipment and techniques that match the design intention and use them safely \u2014 applying appropriate safety, hygiene and environmental practices for the context.",
    "nodes": [
      {
        "id": 1,
        "label": "Matching materials and techniques to the design intention",
        "progression_checkpoint": "Students can select materials and techniques that match the design intention and explain why each choice is appropriate",
        "minimum_width": "Select a material and technique for a specific task and explain why each matches the design intention \u2014 referencing at least one material property",
        "typical_width": "Choose appropriate materials, tools, equipment and techniques for a specific design purpose; explain how the selection matches the design intention \u2014 considering function, aesthetics and sustainability; demonstrate that the selection produces the intended result",
        "wider": [
          "Match material and joining techniques to the design intention for a textile project (e.g. a community banner, a fabric bag) \u2014 accurately cutting and joining fabric pieces as specified by the design",
          "Select and sequence materials, tools and equipment for an electronic product \u2014 explaining how each component choice supports the circuit's intended function",
          "Select and justify materials for a water-resistant, floating craft \u2014 explaining which material properties (density, water resistance, structural strength) determine the selection"
        ],
        "response_modes": [
          {
            "mode": "context_breadth",
            "reason": "Students typically select familiar materials by habit rather than matching properties to design intention. Multiple production contexts \u2014 textiles, electronics, food, structural \u2014 each requiring different property reasoning help students build the habit of justifying selection against design requirements rather than defaulting to familiarity.",
            "flags": [
              "hinge"
            ]
          }
        ],
        "width_opportunity": false,
        "width_opportunity_reason": null,
        "success_criteria": [
          "Selects materials and techniques appropriate for the design intention",
          "Explains the selection by referencing at least one relevant material property or technique characteristic"
        ],
        "related_standards": [
          "AC9TDE4P03",
          "AC9TDE6K05",
          "AC9TDE6P01"
        ],
        "hinge": true,
        "hinge_reason": "Material and technique selection in N1 determines what safety practices apply in N2 \u2014 students who cannot match materials to design intention will select inappropriate tools or techniques, making N2's safety and hygiene requirements impossible to apply correctly."
      },
      {
        "id": 2,
        "label": "Working safely and applying food, hygiene and environmental practices",
        "progression_checkpoint": "Students can identify and apply the relevant safety, hygiene and environmental practices for their production context",
        "minimum_width": "Identify at least two relevant safety or hygiene practices for a specific production task and apply them correctly",
        "typical_width": "Apply appropriate personal protective equipment (PPE), safe work practices, hygiene standards and environmental considerations relevant to the production context \u2014 whether food preparation, garden cultivation or construction of electronic or structural products; explain why each practice is required",
        "wider": [
          "Apply food safety and hygiene practices in preparing a food product \u2014 including washing produce to remove residues, safe disposal of cooking oils, refrigerated storage of perishables, and managing food allergen risks",
          "Apply safe work practices for construction tasks (e.g. protective eyewear, safe tool handling) \u2014 explaining how each practice prevents a specific risk",
          "Identify environmental considerations when making with materials \u2014 e.g. safe disposal of chemical residues, minimising material waste, selecting materials with lower environmental impact"
        ],
        "response_modes": [
          {
            "mode": "consolidation",
            "reason": "Safety and hygiene practices require consistent application across contexts, not just recognition. Students who can name practices but don't apply them consistently need deliberate practice opportunities where the habit is formed through repetition across different production contexts."
          }
        ],
        "width_opportunity": false,
        "width_opportunity_reason": null,
        "success_criteria": [
          "Applies at least two relevant safety or hygiene practices correctly for the production context",
          "Can explain why each practice is required"
        ],
        "related_standards": [
          "AC9TDE6K04",
          "AC9TDE6K05"
        ],
        "hinge": false,
        "hinge_reason": null
      }
    ]
  }
}